{
  "totalPayments": 613.99,
  "totalOneOffPayments": 13.99,
  "totalPaymentsBeforeTaxYearStart": 120.00,
  "totalPaymentsAfterTaxYearEnd": 82.00,
  "sharesOrSecurities": 300.00,
  "ukCharityGift": {
    "landAndBuildings": 400.00
  },
  "nonUKCharityGift": {
    "investments": 800.00,
    "payments": 500.00
  }
}